{"id":"SN-20260824-023800-evidence-promotion-boundary","type":"architecture","title":"Evidence Promotion Became a Mechanical Governance Boundary","status":"ACTIVE","created_at":"2026-08-24T02:38:00Z","effective_at":"2026-08-24T02:38:00Z","superseded_at":null,"source":{"kind":"github","path":"SoulSchoolAcademy/NayaPOWER/pull/37","commit":"d5109097d3fec5ddebf75c3a6dd5ee43eab12448","conversation_ref":null},"summary":"The existing Claim → Evidence → Verification → Oscar chain now has a deterministic promotion ladder that distinguishes eligibility from canonical promotion and blocks stale, superseded, conflicting, wrong-commit, unprovenance, forbidden-source, and production-unsupported promotion.","what_happened":"A small promotion runtime was added on top of the existing evidence authority chain. Fresh CI on PR #37 ran ten Claim/Evidence tests, thirteen Oscar tests, thirteen promotion tests, exact-head verification, Oscar challenge, and current evidence evaluation; the machine-readable artifact bound the result to commit d5109097d3fec5ddebf75c3a6dd5ee43eab12448.","what_we_learned":["Eligibility must not silently become canonical truth.","Current evidence must match the exact commit and remain non-superseded.","Conflicting current evidence must block promotion rather than allow a convenient PASS to win.","Production-safe requires production evidence; test or documentation evidence cannot establish production safety.","Oscar acceptance is a gate in the existing authority chain, not a replacement for explicit governance promotion."],"why_it_matters":"This closes the remaining gap between something being independently accepted and something being allowed to become canonical state, while preserving one authority chain.","what_changed":["Added .naya/runtime/promotion_runtime.py.","Added thirteen adversarial promotion tests.","Extended Claim Evidence CI to run Oscar and promotion tests and evaluate current evidence through the promotion boundary.","Defined UNVERIFIED → BUILDER_VERIFIED → OSCAR_ACCEPTED → CANONICAL_VERIFIED → PRODUCTION_SAFE.","Required explicit promotion decisions for canonical and production promotion."],"next_best_action":"Maintain the promotion boundary as the gate for every future claim and add production evidence only when a real production claim is being evaluated.","tags":["promotion","claim","evidence","oscar","governance","provenance","freshness","canonical","production-safe"],"aliases":["evidence promotion","promotion ladder","canonical promotion boundary","eligibility gate","production safe gate"],"relationships":{"related":["SN-20260824-020000-claim-evidence-runtime","SN-20260823-231200-restore-runtime-execution","SN-20260823-220001-memory-brain-principle"],"supersedes":null,"superseded_by":null,"depends_on":["SN-20260824-020000-claim-evidence-runtime"]},"confidence":"HIGH","evidence":["GitHub Actions run 32683644082 — Naya Power Claim Evidence Enforcement — success","PR #37 head d5109097d3fec5ddebf75c3a6dd5ee43eab12448","Artifact 9504912190 — naya-claim-evidence-d5109097d3fec5ddebf75c3a6dd5ee43eab12448","Oscar verdict ACCEPT with promotion_allowed=true and exact expected_commit"]}
